fide_id,period,rating_type,tournament_name,event_location_fed,event_start_date,event_end_date,event_rc,event_ro,event_score,event_games,event_chg,event_k,event_k_chg,opponent_name,opponent_title,opponent_rating,rating_difference_over_400_flag,opponent_fed,score,n,chg,k,k_chg
88105857,2024-05-01,0,UP State U-17 International Rating Chess Championship-2024-25 (Open),Kaushambi IND,2024-04-22,2024-04-24,,,1.0,2,0.0,1492,,"Atiksh, Sagar",,1507,False,IND,1.0,1,0.0,,0.0
88105857,2024-05-01,0,UP State U-17 International Rating Chess Championship-2024-25 (Open),Kaushambi IND,2024-04-22,2024-04-24,,,1.0,2,0.0,1492,,"Pranav, Shukla",,1476,False,IND,0.0,1,0.0,,0.0
88105857,2024-08-01,0,UP State U-15 Chess Championship-2024-25 (Open),Ballia IND,2024-07-10,2024-07-12,,,0.0,2,0.0,661,,"Aarav, Gupta",,1515,False,IND,0.0,1,0.0,,0.0
88105857,2024-08-01,0,UP State U-15 Chess Championship-2024-25 (Open),Ballia IND,2024-07-10,2024-07-12,,,0.0,2,0.0,661,,"Md, Haider",,1407,False,IND,0.0,1,0.0,,0.0
88105857,2025-04-01,0,1st DPSS Chess For Everyone International FIDE Rating Chess Tournament 2025,Sagar IND,2025-03-23,2025-03-27,,,1.0,3,0.0,1367,,"Praveen, Chitteti",,1469,False,IND,1.0,1,0.0,,0.0
88105857,2025-04-01,0,1st DPSS Chess For Everyone International FIDE Rating Chess Tournament 2025,Sagar IND,2025-03-23,2025-03-27,,,1.0,3,0.0,1367,,"Rudraksh, Garg",,1523,False,IND,0.0,1,0.0,,0.0
88105857,2025-04-01,0,1st DPSS Chess For Everyone International FIDE Rating Chess Tournament 2025,Sagar IND,2025-03-23,2025-03-27,,,1.0,3,0.0,1367,,"Hari, Krishna Reddy J",,1484,False,IND,0.0,1,0.0,,0.0
