fide_id,period,rating_type,tournament_name,event_location_fed,event_start_date,event_end_date,event_rc,event_ro,event_score,event_games,event_chg,event_k,event_k_chg,opponent_name,opponent_title,opponent_rating,rating_difference_over_400_flag,opponent_fed,score,n,chg,k,k_chg
88184900,2024-06-01,0,Rajasthan State U-17 FIDE Rating Selection Chess Championship-2024,Udaipur IND,2024-05-24,2024-05-26,1423,1627,0.5,1,-0.26,40,-10.4,"Yuvraj, Vaishnav",,1423.0,False,IND,0.5,1,-0.26,40,-10.4
88184900,2024-08-01,0,Smt Chanchal Dad Memorial Open International FIDE Rating Chess Tournament-2024,Bhilwara IND,2024-07-24,2024-07-28,1446,1617,0.0,3,-2.17,40,-86.8,"Vibhor, Chopra",,1416.0,False,IND,0.0,1,-0.76,40,-30.4
88184900,2024-08-01,0,Smt Chanchal Dad Memorial Open International FIDE Rating Chess Tournament-2024,Bhilwara IND,2024-07-24,2024-07-28,1446,1617,0.0,3,-2.17,40,-86.8,"Bagul, Vinit",,1450.0,False,IND,0.0,1,-0.72,40,-28.8
88184900,2024-08-01,0,Smt Chanchal Dad Memorial Open International FIDE Rating Chess Tournament-2024,Bhilwara IND,2024-07-24,2024-07-28,1446,1617,0.0,3,-2.17,40,-86.8,"Kavyansh, Vaishnav",,1472.0,False,IND,0.0,1,-0.69,40,-27.6
88184900,2025-01-01,0,Bhilwara All India Open FIDE Rating Chess Tournament 2024,Bhilwara IND,2024-12-24,2024-12-29,1746,1530,0.0,1,-0.22,40,-8.8,"Vikramaditya, Mukhija",,1746.0,False,IND,0.0,1,-0.22,40,-8.8
